<?xml version="1.0" encoding="UTF-8"?>

<adatbazis xmlns:xsi="http://www.w3.org/2001/XMLSchema-instance"
 xsi:noNamespaceSchemaLocation="V9RN7Cxml.xsd">
    <!--Tulajdonos -->
    <tulajdonos t_id="sgh-32h-j2" fesz_t="dh2-82k-ds">
        <cegnev>Providence Equity Partners</cegnev>
        <adoszam>312316312</adoszam>
        <alapitas>1989</alapitas>
        <bevetel>31000000000</bevetel>
    </tulajdonos>
    <!--Fesztivál -->
    <fesztival fesz_id="dh2-82k-ds">
        <nev>Balaton Sound</nev>
        <helyszin>Zamárdi</helyszin>
        <ev>2022</ev>
    </fesztival>
    <!--Fellépő -->
    <fellepo fel_id="312-sda-ma" fesz_fel="dh2-82k-ds">
        <nev>Paul Kalkbrenner</nev>
        <orszag>Németország</orszag>
        <dij>3000000</dij>
    </fellepo>
    <fellepo fel_id="wdn-w72-as" fesz_fel="dh2-82k-ds">
        <nev>Alesso</nev>
        <orszag>Svédország</orszag>
        <dij>6000000</dij>
    </fellepo>
    <fellepo fel_id="km7-h7g-2s" fesz_fel="dh2-82k-ds">
        <nev>Martin Garrix</nev>
        <orszag>Hollandia</orszag>
        <dij>7000000</dij>
    </fellepo>
    <!--Bár -->
    <bar b_id="ads-h2w-w2" fesz_b="dh2-82k-ds">
        <nev>Dreher bár</nev>
        <ital>Sör</ital>
        <ital>Vodka</ital>
        <ital>Whisky</ital>
        <cegnev>Dreher Sörgyárak Zrt.</cegnev>
    </bar>
    <bar b_id="mub-322-ds" fesz_b="dh2-82k-ds">
        <nev>Jana Aqua bár</nev>
        <ital>Ásványvíz</ital>
        <ital>Jägermeister</ital>
        <ital>Cognac</ital>
        <cegnev>AQUA Kft.</cegnev>
    </bar>
    <bar b_id="mnd-hb7-20" fesz_b="dh2-82k-ds">
        <nev>Foods and Drinks</nev>
        <ital>Vodka</ital>
        <ital>Energiaital</ital>
	<ital>Gin</ital>
        <cegnev>Zamardi Foods Kft.</cegnev>
    </bar>
    <!--Alkalmazott -->
    <alkalmazott a_id="mnh-hgf-j7" b_a="mub-322-ds">
        <nev>Dobos Sára</nev>
        <fizetes>321200</fizetes>
        <muszak>péntek-szombat</muszak>
        <muszak>szerda</muszak>
    </alkalmazott>
    <alkalmazott a_id="sha-dw7-wa" b_a="mnd-hb7-20">
        <nev>Papp Márton</nev>
        <fizetes>400000</fizetes>
        <muszak>szerda-péntek</muszak>
        <muszak>szombat</muszak>
    </alkalmazott>
    <alkalmazott a_id="dsa-wa6-42" b_a="mnd-hb7-20">
        <nev>Varga István</nev>
        <fizetes>410000</fizetes>
        <muszak>szombat</muszak>
        <muszak>csütörtök</muszak>
    </alkalmazott>
    
    <!--Résztvevő -->
    <resztvevo r_id="wda-312-s2" fesz_r="dh2-82k-ds">
        <nev>Pataki Patrícia</nev>
        <diakigazolvany>true</diakigazolvany>
        <lakcim>
            <telepules>Szombathely</telepules>
            <utca>Tolnai Lajos utca</utca>
            <hazszam>23</hazszam>
        </lakcim>
    </resztvevo>
    <resztvevo r_id="daw-29k-ws" fesz_r="dh2-82k-ds">
        <nev>Halász Milán</nev>
        <diakigazolvany>true</diakigazolvany>
        <lakcim>
            <telepules>Miskolc</telepules>
            <utca>Herend utca</utca>
            <hazszam>100</hazszam>
        </lakcim>
    </resztvevo>
    <resztvevo r_id="dwj-82w-sa" fesz_r="dh2-82k-ds">
        <nev>Somogyi Linda</nev>
        <diakigazolvany>false</diakigazolvany>
        <lakcim>
            <telepules>Karcag</telepules>
            <utca>Kardhegy utca</utca>
            <hazszam>33</hazszam>
        </lakcim>
    </resztvevo>

    <!--Közvélemény (kapcsolótábla) -->
    <kozvelemeny r_k_r="dwj-82w-sa" ny_k_ny="dag-213-sd">
        <kerdezo>Szűcs Vilmos</kerdezo>
    </kozvelemeny>
    <kozvelemeny r_k_r="dwj-82w-sa" ny_k_ny="kjg-mhz-2d">
        <kerdezo>Szűcs Vilmos</kerdezo>
    </kozvelemeny>
    <kozvelemeny r_k_r="daw-29k-ws" ny_k_ny="sk6-wss-31">
        <kerdezo>Jónás Judit</kerdezo>
    </kozvelemeny>
    <kozvelemeny r_k_r="wda-312-s2" ny_k_ny="jnu-21g-bs">
        <kerdezo>Szűcs Vilmos</kerdezo>
    </kozvelemeny>

    <!--Nyelvtudás -->
    <nyelvtudas ny_id="dag-213-sd">
        <nyelv>angol</nyelv>
        <szint>közép</szint>
    </nyelvtudas>
    <nyelvtudas ny_id="sk6-wss-31">
        <nyelv>angol</nyelv>
        <szint>emelt</szint>
    </nyelvtudas>
    <nyelvtudas ny_id="kjg-mhz-2d">
        <nyelv>német</nyelv>
        <szint>kezdő</szint>
    </nyelvtudas>
    <nyelvtudas ny_id="jnu-21g-bs">
        <nyelv>francia</nyelv>
        <szint>közép</szint>
    </nyelvtudas>
</adatbazis>